{
  "$schema": "http://json-schema.org/draft-07/schema#",
  "$id": "https://littledays.app/schemas/tutor/lesson.schema.json",
  "title": "Aliz Tutor lesson",
  "description": "One deterministic lesson for Aliz Tutor Mode: a 5-minute session, a short starter, or a one-step menu (kind choose). The LessonEngine owns pass/fail, progression, routing and rewards from this data alone; an LLM may only rephrase wording later and never changes expectedAnswers, stars or order. All keys are camelCase. Text is English, ASCII-printable, and short enough to be spoken as one TutorTurn (speech <= 160 chars, question <= 120 chars). Rules that depend on the step kind live in x-requiredByKind and x-forbiddenByKind so the validator and this file cannot drift.",
  "type": "object",
  "additionalProperties": false,
  "required": [
    "schemaVersion",
    "lessonId",
    "subjectId",
    "title",
    "ageBand",
    "targetDurationSeconds",
    "language",
    "helperLanguageKeys",
    "steps",
    "completion"
  ],
  "properties": {
    "schemaVersion": {
      "type": "integer",
      "const": 1
    },
    "lessonId": {
      "type": "string",
      "pattern": "^[a-z][a-z0-9_]*$",
      "description": "Must equal the file name without .json and appear in exactly one subject's lessonIds."
    },
    "subjectId": {
      "type": "string",
      "pattern": "^[a-z][a-z0-9_]*$",
      "description": "A subjectId from subjects.json, or 'menu' for the entry (choose) lesson."
    },
    "title": {
      "type": "string",
      "minLength": 1,
      "maxLength": 60
    },
    "ageBand": {
      "type": "string",
      "enum": [
        "3-4",
        "4-6",
        "3-6"
      ]
    },
    "targetDurationSeconds": {
      "type": "integer",
      "minimum": 30,
      "maximum": 600,
      "description": "300 for a full session. The validator's estimate (6 s per teach, 12 s per ask plus a 10 s retry allowance, 10 s per celebrate) must land within 20% of this."
    },
    "language": {
      "type": "string",
      "const": "en"
    },
    "helperLanguageKeys": {
      "type": "array",
      "uniqueItems": true,
      "items": {
        "type": "string",
        "pattern": "^[a-z0-9_]+$"
      },
      "description": "Localization.key_for(<English line>) keys the helper-language (Thai by default) second line may translate. Each key must derive from a line that this lesson actually speaks."
    },
    "steps": {
      "type": "array",
      "minItems": 1,
      "maxItems": 24,
      "items": {
        "$ref": "#/definitions/step"
      },
      "description": "A menu lesson is a single choose step. Otherwise the first step is a teach (the greeting), the last step is the single celebrate, and at least one ask or sound step sits between them."
    },
    "completion": {
      "$ref": "#/definitions/completion"
    }
  },
  "definitions": {
    "shortLine": {
      "type": "string",
      "minLength": 1,
      "maxLength": 160
    },
    "questionLine": {
      "type": "string",
      "minLength": 1,
      "maxLength": 120
    },
    "step": {
      "type": "object",
      "additionalProperties": false,
      "required": [
        "stepId",
        "kind"
      ],
      "properties": {
        "stepId": {
          "type": "string",
          "pattern": "^[a-z0-9_]+$",
          "description": "Unique within the lesson."
        },
        "kind": {
          "type": "string",
          "enum": [
            "teach",
            "ask",
            "sound",
            "celebrate",
            "choose"
          ],
          "description": "teach: Aliz speaks. ask: a question with expectedAnswers. sound: like ask but expects an onomatopoeia and carries a reaction. celebrate: the closing step, stars and sticker. choose: Aliz asks what to learn; choices route to another lesson (lessonAction switch_lesson)."
        },
        "teachText": {
          "$ref": "#/definitions/shortLine",
          "description": "What Aliz says on a teach or celebrate step."
        },
        "questionText": {
          "$ref": "#/definitions/questionLine",
          "description": "The question Aliz asks on an ask step."
        },
        "visualAssetId": {
          "type": "string",
          "pattern": "^[a-z][a-z0-9_]*$",
          "description": "Flashcard shown for the step. Must be listed in res://content/tutor/assets_allowlist.json. Optional on teach/celebrate; every ask step in a full lesson carries one."
        },
        "expectedAnswers": {
          "type": "array",
          "minItems": 1,
          "maxItems": 12,
          "uniqueItems": true,
          "items": {
            "type": "string",
            "minLength": 1,
            "maxLength": 40,
            "pattern": "^[a-z0-9][a-z0-9 ']*$"
          },
          "description": "Lower-case English answers. The FIRST entry is the canonical answer Aliz teaches on the third attempt; the rest are synonyms and phrase forms (\"an apple\", \"it's an apple\"). No transliterations."
        },
        "objective": {
          "type": "string",
          "minLength": 1,
          "maxLength": 120,
          "description": "What the child practises; shown to grown-ups, never scored."
        },
        "hint": {
          "$ref": "#/definitions/shortLine",
          "description": "Spoken on the second unclear/incorrect attempt (give_hint)."
        },
        "encouragement": {
          "$ref": "#/definitions/shortLine",
          "description": "Spoken on the first unclear/incorrect attempt (retry). Kind, short, never says wrong."
        },
        "successLine": {
          "$ref": "#/definitions/shortLine",
          "description": "Spoken when the answer matches. On a sound step it echoes the sound: 'Meow! You're amazing!'"
        },
        "answerLine": {
          "$ref": "#/definitions/shortLine",
          "description": "Optional. Spoken on the third attempt instead of the generated \"It's <answer>! Say <answer>.\""
        },
        "spokenLineId": {
          "type": "string",
          "pattern": "^[a-z0-9_]+$",
          "description": "Optional owner voice-pack line id (for example aliz_006_good_job). When absent the synthesis provider falls back to TTS."
        },
        "itemId": {
          "type": "string",
          "pattern": "^[a-z][a-z0-9_]*$",
          "description": "Groups the steps about one thing (cat, dog, apple). handle_interjection() jumps to the first step of the item a barge-in names."
        },
        "itemLabel": {
          "type": "string",
          "minLength": 1,
          "maxLength": 30,
          "description": "Spoken name of the item ('the dog'). Defaults to itemId with spaces."
        },
        "reaction": {
          "$ref": "#/definitions/reaction"
        },
        "choices": {
          "type": "array",
          "minItems": 1,
          "maxItems": 8,
          "items": {
            "$ref": "#/definitions/choice"
          },
          "description": "choose steps only: the lessons a child can pick, matched by the subject's keywords plus any extra answers."
        },
        "defaultLessonId": {
          "type": "string",
          "pattern": "^[a-z][a-z0-9_]*$",
          "description": "choose steps only: where 'anything', 'you choose', 'I don't know' and a third unclear attempt go."
        },
        "defaultAnswers": {
          "type": "array",
          "minItems": 1,
          "maxItems": 16,
          "uniqueItems": true,
          "items": {
            "type": "string",
            "minLength": 1,
            "maxLength": 40,
            "pattern": "^[a-z0-9][a-z0-9 ']*$"
          }
        },
        "defaultLine": {
          "$ref": "#/definitions/shortLine",
          "description": "choose steps only: spoken when routing to defaultLessonId."
        }
      }
    },
    "completion": {
      "type": "object",
      "additionalProperties": false,
      "required": [
        "stars"
      ],
      "properties": {
        "stars": {
          "type": "integer",
          "minimum": 0,
          "maximum": 5,
          "description": "Awarded once per lesson by LessonEngine when the last step is passed. 0 only for a menu lesson. Never reduced, never withheld."
        },
        "stickerId": {
          "type": "string",
          "pattern": "^[a-z][A-Za-z0-9_]*$",
          "description": "Required when stars > 0."
        },
        "celebrationLine": {
          "$ref": "#/definitions/shortLine"
        }
      }
    },
    "reaction": {
      "type": "object",
      "additionalProperties": false,
      "required": [
        "gesture",
        "sfx",
        "alizSound"
      ],
      "description": "How Aliz reacts to a correct sound (or ask) answer: a TutorFace gesture, a bundled sfx id, and the sound she makes back.",
      "properties": {
        "gesture": {
          "type": "string",
          "enum": [
            "none",
            "nod",
            "tilt",
            "point",
            "clap",
            "wave"
          ]
        },
        "sfx": {
          "type": "string",
          "enum": [
            "none",
            "laugh",
            "giggle",
            "cheer",
            "sparkle"
          ]
        },
        "alizSound": {
          "type": "string",
          "minLength": 1,
          "maxLength": 40
        }
      }
    },
    "choice": {
      "type": "object",
      "additionalProperties": false,
      "description": "One route out of a choose step. lessonId or subjectId (whose first lessonId is used); answers are merged with the subject's keywords from subjects.json.",
      "properties": {
        "lessonId": {
          "type": "string",
          "pattern": "^[a-z][a-z0-9_]*$"
        },
        "subjectId": {
          "type": "string",
          "pattern": "^[a-z][a-z0-9_]*$"
        },
        "answers": {
          "type": "array",
          "minItems": 1,
          "maxItems": 24,
          "uniqueItems": true,
          "items": {
            "type": "string",
            "minLength": 1,
            "maxLength": 40,
            "pattern": "^[a-z0-9][a-z0-9 ']*$"
          }
        },
        "line": {
          "$ref": "#/definitions/shortLine",
          "description": "Spoken when this choice is picked. Defaults to 'Okay! Let's learn about <subject title>!'"
        }
      }
    }
  },
  "x-requiredByKind": {
    "teach": [
      "teachText"
    ],
    "ask": [
      "questionText",
      "expectedAnswers",
      "objective",
      "hint",
      "encouragement",
      "successLine"
    ],
    "sound": [
      "questionText",
      "expectedAnswers",
      "objective",
      "hint",
      "encouragement",
      "successLine",
      "reaction"
    ],
    "celebrate": [
      "teachText"
    ],
    "choose": [
      "questionText",
      "hint",
      "encouragement",
      "choices",
      "defaultLessonId",
      "defaultAnswers"
    ]
  },
  "x-forbiddenByKind": {
    "teach": [
      "questionText",
      "expectedAnswers",
      "hint",
      "choices"
    ],
    "ask": [
      "teachText",
      "choices",
      "defaultLessonId"
    ],
    "sound": [
      "teachText",
      "choices",
      "defaultLessonId"
    ],
    "celebrate": [
      "questionText",
      "expectedAnswers",
      "hint",
      "choices"
    ],
    "choose": [
      "teachText",
      "expectedAnswers",
      "reaction",
      "itemId"
    ]
  },
  "x-durationModel": {
    "teachSeconds": 6,
    "askSeconds": 12,
    "askRetryAllowanceSeconds": 10,
    "soundSeconds": 8,
    "soundRetryAllowanceSeconds": 6,
    "chooseSeconds": 15,
    "celebrateSeconds": 10,
    "toleranceRatio": 0.2
  }
}
