{
  "schemaVersion": 1,
  "lessonId": "colors_red_blue",
  "subjectId": "colors",
  "title": "Red and Blue",
  "ageBand": "3-6",
  "targetDurationSeconds": 60,
  "language": "en",
  "helperLanguageKeys": [
    "lets_look_at_colours",
    "what_colour_is_this",
    "you_know_red_and_blue"
  ],
  "steps": [
    {
      "stepId": "s01_hello",
      "kind": "teach",
      "teachText": "Let's look at colours! Red and blue!",
      "visualAssetId": "color_red"
    },
    {
      "stepId": "s02_red",
      "kind": "ask",
      "itemId": "red",
      "itemLabel": "red",
      "questionText": "What colour is this?",
      "visualAssetId": "color_red",
      "expectedAnswers": [
        "red",
        "it's red",
        "the colour red",
        "the color red"
      ],
      "objective": "Name the colour red",
      "hint": "It's the colour of an apple and a fire truck. R-r-red!",
      "encouragement": "Let's try together! What colour is this?",
      "successLine": "Yes! Red!",
      "answerLine": "It's red! Say red."
    },
    {
      "stepId": "s03_blue",
      "kind": "ask",
      "itemId": "blue",
      "itemLabel": "blue",
      "questionText": "What colour is this?",
      "visualAssetId": "color_blue",
      "expectedAnswers": [
        "blue",
        "it's blue",
        "the colour blue",
        "the color blue"
      ],
      "objective": "Name the colour blue",
      "hint": "It's the colour of the sky and the sea. Blue!",
      "encouragement": "Let's try together! What colour is this?",
      "successLine": "Yes! Blue!",
      "answerLine": "It's blue! Say blue."
    },
    {
      "stepId": "s04_celebrate",
      "kind": "celebrate",
      "teachText": "You know red and blue! Here is your sticker!",
      "visualAssetId": "color_blue"
    }
  ],
  "completion": {
    "stars": 1,
    "stickerId": "rainbowSticker"
  }
}
