{
  "schemaVersion": 1,
  "lessonId": "animals_cat_dog",
  "subjectId": "animals",
  "title": "Cat and Dog",
  "ageBand": "3-6",
  "targetDurationSeconds": 90,
  "language": "en",
  "helperLanguageKeys": ["yay_lets_learn_about_animals", "what_animal_is_this", "can_you_make_a_cat_sound", "can_you_make_a_dog_sound", "you_met_a_cat_and_a_dog"],
  "steps": [
    {
      "stepId": "s01_hello",
      "kind": "teach",
      "teachText": "Yay! Let's learn about animals!",
      "visualAssetId": "cat"
    },
    {
      "stepId": "s02_cat",
      "kind": "ask",
      "itemId": "cat",
      "itemLabel": "the cat",
      "questionText": "What animal is this?",
      "visualAssetId": "cat",
      "expectedAnswers": ["cat", "a cat", "it's a cat", "kitty", "kitten", "cats"],
      "objective": "Name the animal: cat",
      "hint": "It says meow. It has whiskers and a long tail. A cat!",
      "encouragement": "Let's try together! What animal is this?",
      "successLine": "Great! It's a cat!",
      "answerLine": "It's a cat! Say cat."
    },
    {
      "stepId": "s03_cat_sound",
      "kind": "sound",
      "itemId": "cat",
      "itemLabel": "the cat",
      "questionText": "Can you make a cat sound?",
      "visualAssetId": "cat",
      "expectedAnswers": ["meow", "miaow", "mew", "meow meow", "miao", "nyan", "purr"],
      "objective": "Make the cat sound: meow",
      "hint": "A cat says meow! Can you say meow?",
      "encouragement": "Let's try together! Meow!",
      "successLine": "Meow! You're amazing!",
      "answerLine": "A cat says meow! Say meow.",
      "reaction": {"gesture": "clap", "sfx": "laugh", "alizSound": "Meow!"}
    },
    {
      "stepId": "s04_dog",
      "kind": "ask",
      "itemId": "dog",
      "itemLabel": "the dog",
      "questionText": "What animal is this?",
      "visualAssetId": "dog",
      "expectedAnswers": ["dog", "a dog", "it's a dog", "puppy", "doggy", "dogs"],
      "objective": "Name the animal: dog",
      "hint": "It says woof. It wags its tail. A dog!",
      "encouragement": "Let's try together! What animal is this?",
      "successLine": "Great! It's a dog!",
      "answerLine": "It's a dog! Say dog."
    },
    {
      "stepId": "s05_dog_sound",
      "kind": "sound",
      "itemId": "dog",
      "itemLabel": "the dog",
      "questionText": "Can you make a dog sound?",
      "visualAssetId": "dog",
      "expectedAnswers": ["woof", "bark", "ruff", "arf", "bow wow", "woof woof", "wuff", "bowwow"],
      "objective": "Make the dog sound: woof",
      "hint": "A dog says woof! Can you say woof?",
      "encouragement": "Let's try together! Woof!",
      "successLine": "Woof! You're amazing!",
      "answerLine": "A dog says woof! Say woof.",
      "reaction": {"gesture": "clap", "sfx": "laugh", "alizSound": "Woof!"}
    },
    {
      "stepId": "s06_celebrate",
      "kind": "celebrate",
      "teachText": "You met a cat and a dog! Here is your sticker!",
      "visualAssetId": "dog"
    }
  ],
  "completion": {
    "stars": 1,
    "stickerId": "heartSticker"
  }
}
